{
  "schema_version": "scm-strategy.web/1",
  "dataset_kind": "synthetic",
  "generator": {
    "version": "scm-strategy.equations/1",
    "seed": 20261030,
    "parameters": {
      "participants": 60
    }
  },
  "units": {
    "speed_kmh": "km/h",
    "height_cm": "cm",
    "weight_kg": "kg",
    "age_years": "year",
    "navicular_ratio": "1",
    "foot_size_proxy_cm2": "cm^2",
    "knee_excursion_deg": "degree",
    "ankle_excursion_deg": "degree",
    "contact_ms": "ms",
    "pressure_peak_N": "N",
    "effective_area_cm2": "cm^2"
  },
  "records": [
    {
      "participant_id": "SYN-00001",
      "speed_kmh": 9.796224092732631,
      "height_cm": 175.2955345623606,
      "weight_kg": 56.65095068354278,
      "age_years": 41.36263503380501,
      "navicular_ratio": 0.19793950327779852,
      "foot_size_proxy_cm2": 236.5080227575492,
      "knee_excursion_deg": 49.723556108017384,
      "ankle_excursion_deg": 39.213251188218536,
      "contact_ms": 266.0270938086994,
      "pressure_peak_N": 1161.0478095296453,
      "effective_area_cm2": 113.31170877328866
    },
    {
      "participant_id": "SYN-00002",
      "speed_kmh": 7.5733170190700045,
      "height_cm": 152.85647567766836,
      "weight_kg": 81.76789369626488,
      "age_years": 29.42814178314303,
      "navicular_ratio": 0.13930799097723737,
      "foot_size_proxy_cm2": 289.8029339173677,
      "knee_excursion_deg": 51.52340556846828,
      "ankle_excursion_deg": 32.44700243882428,
      "contact_ms": 292.1900181354115,
      "pressure_peak_N": 1313.5028794419954,
      "effective_area_cm2": 134.01477424255157
    },
    {
      "participant_id": "SYN-00003",
      "speed_kmh": 12.3287506778166,
      "height_cm": 189.56618084283625,
      "weight_kg": 70.9671247810027,
      "age_years": 33.44568135361693,
      "navicular_ratio": 0.12881873818835554,
      "foot_size_proxy_cm2": 307.87835870580267,
      "knee_excursion_deg": 53.723624955440954,
      "ankle_excursion_deg": 39.24059722608922,
      "contact_ms": 239.87385460152836,
      "pressure_peak_N": 1593.3116925999648,
      "effective_area_cm2": 128.90062922693113
    },
    {
      "participant_id": "SYN-00004",
      "speed_kmh": 7.275740640280574,
      "height_cm": 165.40522726942774,
      "weight_kg": 79.2829129585653,
      "age_years": 60.38524447077225,
      "navicular_ratio": 0.11840988763111146,
      "foot_size_proxy_cm2": 279.10329481999884,
      "knee_excursion_deg": 34.56110215753224,
      "ankle_excursion_deg": 33.28634423544144,
      "contact_ms": 292.62204384698003,
      "pressure_peak_N": 1134.8300460102762,
      "effective_area_cm2": 119.6104592284451
    },
    {
      "participant_id": "SYN-00005",
      "speed_kmh": 10.144467274245345,
      "height_cm": 188.66178810753544,
      "weight_kg": 89.86162280063651,
      "age_years": 59.95274599720271,
      "navicular_ratio": 0.1271864817442648,
      "foot_size_proxy_cm2": 271.11434555718046,
      "knee_excursion_deg": 43.37692037731868,
      "ankle_excursion_deg": 39.716354252505276,
      "contact_ms": 269.588739844212,
      "pressure_peak_N": 1538.2969669590072,
      "effective_area_cm2": 128.77173191816007
    },
    {
      "participant_id": "SYN-00006",
      "speed_kmh": 10.898322809241762,
      "height_cm": 173.8790049777073,
      "weight_kg": 77.4282494654125,
      "age_years": 21.95964263950432,
      "navicular_ratio": 0.1186624106927546,
      "foot_size_proxy_cm2": 286.7186967662168,
      "knee_excursion_deg": 41.82521143267299,
      "ankle_excursion_deg": 38.53286605178873,
      "contact_ms": 263.2252851470372,
      "pressure_peak_N": 1458.9788513117837,
      "effective_area_cm2": 117.30082208289498
    },
    {
      "participant_id": "SYN-00007",
      "speed_kmh": 9.656860253751152,
      "height_cm": 171.20736618462772,
      "weight_kg": 53.87870503309557,
      "age_years": 61.38388323130132,
      "navicular_ratio": 0.16223283386585516,
      "foot_size_proxy_cm2": 251.34496223925072,
      "knee_excursion_deg": 51.03468574247079,
      "ankle_excursion_deg": 37.64489775681537,
      "contact_ms": 262.64273430969854,
      "pressure_peak_N": 1073.4802240702852,
      "effective_area_cm2": 113.9947287967893
    },
    {
      "participant_id": "SYN-00008",
      "speed_kmh": 9.270770221415736,
      "height_cm": 166.3984482501795,
      "weight_kg": 74.96314449757278,
      "age_years": 57.75634312957363,
      "navicular_ratio": 0.1491309301948595,
      "foot_size_proxy_cm2": 295.5885255534633,
      "knee_excursion_deg": 48.15348486160795,
      "ankle_excursion_deg": 36.09803850413839,
      "contact_ms": 279.75707386780954,
      "pressure_peak_N": 1341.4753497355625,
      "effective_area_cm2": 130.23059681220673
    },
    {
      "participant_id": "SYN-00009",
      "speed_kmh": 11.636114977520377,
      "height_cm": 166.72783685609215,
      "weight_kg": 75.21708742833728,
      "age_years": 33.807374473669505,
      "navicular_ratio": 0.19926375742541944,
      "foot_size_proxy_cm2": 302.230101943146,
      "knee_excursion_deg": 47.95101519852159,
      "ankle_excursion_deg": 46.1314017307568,
      "contact_ms": 245.46253857196868,
      "pressure_peak_N": 1528.8831542527032,
      "effective_area_cm2": 137.6931223080955
    },
    {
      "participant_id": "SYN-00010",
      "speed_kmh": 12.733035989047497,
      "height_cm": 175.45024633388377,
      "weight_kg": 78.47437769317148,
      "age_years": 43.69903156051443,
      "navicular_ratio": 0.13804713896311513,
      "foot_size_proxy_cm2": 310.14351649130936,
      "knee_excursion_deg": 57.222576386404356,
      "ankle_excursion_deg": 35.74877482906678,
      "contact_ms": 236.96159174663705,
      "pressure_peak_N": 1832.510953262426,
      "effective_area_cm2": 133.36683576090016
    },
    {
      "participant_id": "SYN-00011",
      "speed_kmh": 11.820908380198752,
      "height_cm": 153.39803232913286,
      "weight_kg": 79.82758007187563,
      "age_years": 51.73508185054195,
      "navicular_ratio": 0.11566130802891378,
      "foot_size_proxy_cm2": 288.8387956952884,
      "knee_excursion_deg": 52.11508217002332,
      "ankle_excursion_deg": 41.4157106312718,
      "contact_ms": 225.67141479737646,
      "pressure_peak_N": 1602.8619552605903,
      "effective_area_cm2": 125.77179381415603
    },
    {
      "participant_id": "SYN-00012",
      "speed_kmh": 8.974518347306812,
      "height_cm": 156.95750315462388,
      "weight_kg": 61.417127616761256,
      "age_years": 32.89853919150253,
      "navicular_ratio": 0.1395425222747651,
      "foot_size_proxy_cm2": 295.28690552541923,
      "knee_excursion_deg": 44.874164901698784,
      "ankle_excursion_deg": 38.26006904911424,
      "contact_ms": 276.8651706795959,
      "pressure_peak_N": 1073.3091885094254,
      "effective_area_cm2": 129.58743673083268
    },
    {
      "participant_id": "SYN-00013",
      "speed_kmh": 11.156980084025761,
      "height_cm": 173.1200661333855,
      "weight_kg": 86.07603221906496,
      "age_years": 34.50337069855585,
      "navicular_ratio": 0.16956234271431975,
      "foot_size_proxy_cm2": 293.5122129150458,
      "knee_excursion_deg": 57.415564941007915,
      "ankle_excursion_deg": 38.573975517868305,
      "contact_ms": 236.52632633526903,
      "pressure_peak_N": 1696.9773716122284,
      "effective_area_cm2": 133.8059421185322
    },
    {
      "participant_id": "SYN-00014",
      "speed_kmh": 7.4048223369207875,
      "height_cm": 168.60544917329995,
      "weight_kg": 59.93198073748479,
      "age_years": 53.63041050646718,
      "navicular_ratio": 0.15404098433267274,
      "foot_size_proxy_cm2": 250.70474950826684,
      "knee_excursion_deg": 41.28540727831481,
      "ankle_excursion_deg": 38.06036547077532,
      "contact_ms": 315.65834490082545,
      "pressure_peak_N": 1015.6136140646678,
      "effective_area_cm2": 114.18733530591601
    },
    {
      "participant_id": "SYN-00015",
      "speed_kmh": 8.17961349660993,
      "height_cm": 161.91975134901327,
      "weight_kg": 78.6211342226502,
      "age_years": 48.87650878917571,
      "navicular_ratio": 0.13563070220911622,
      "foot_size_proxy_cm2": 277.8795215936775,
      "knee_excursion_deg": 43.86670555270953,
      "ankle_excursion_deg": 37.845890564536354,
      "contact_ms": 289.02340707662086,
      "pressure_peak_N": 1315.6730235834823,
      "effective_area_cm2": 125.73444236973597
    },
    {
      "participant_id": "SYN-00016",
      "speed_kmh": 12.638727375075472,
      "height_cm": 183.13228095422613,
      "weight_kg": 87.82006848976884,
      "age_years": 43.920893118078524,
      "navicular_ratio": 0.1733137321288602,
      "foot_size_proxy_cm2": 243.70020629223492,
      "knee_excursion_deg": 50.7726159044066,
      "ankle_excursion_deg": 43.7860536300367,
      "contact_ms": 235.4143731480487,
      "pressure_peak_N": 1725.5188888259897,
      "effective_area_cm2": 122.61954124751104
    },
    {
      "participant_id": "SYN-00017",
      "speed_kmh": 8.14894306035166,
      "height_cm": 160.00290531005325,
      "weight_kg": 90.59908781008804,
      "age_years": 22.697851004718743,
      "navicular_ratio": 0.14362059231119095,
      "foot_size_proxy_cm2": 265.96331516524526,
      "knee_excursion_deg": 43.13394785910276,
      "ankle_excursion_deg": 34.877352654184605,
      "contact_ms": 275.9941811026221,
      "pressure_peak_N": 1446.8592147747995,
      "effective_area_cm2": 126.61844363803907
    },
    {
      "participant_id": "SYN-00018",
      "speed_kmh": 12.610928073815348,
      "height_cm": 178.09998348328244,
      "weight_kg": 78.00296458174972,
      "age_years": 26.44350385186813,
      "navicular_ratio": 0.11532530634455049,
      "foot_size_proxy_cm2": 220.5906264847666,
      "knee_excursion_deg": 48.537035942047424,
      "ankle_excursion_deg": 44.0379779274485,
      "contact_ms": 249.0361934335991,
      "pressure_peak_N": 1579.7237301462214,
      "effective_area_cm2": 110.34680319396709
    },
    {